{
  "schema_version": "1.0.0",
  "assembly_id": "ariad_two_servo_robot_component_first_rev_a",
  "name": "Ariad Two-Servo Robot — Component-First Rev A",
  "purpose": "A serviceable two-servo embodied-AI robot enclosure designed from selected Raspberry Pi Zero 2 W and Feetech SCS0009 hardware envelopes outward.",
  "status": "draft",
  "parts": [
    {"part_id": "front_shell", "name": "Front body shell", "role": "Protect the selected hardware layout and establish camera, servo-axis, tray-latch, ventilation, and rear-service boundaries.", "quantity": 1, "separately_manufactured": true, "manufacturing_process": "FDM", "material": "PETG", "notes": "The larger shell is derived from the internal Pi and dual-servo arrangement; external proportions are secondary to component access."},
    {"part_id": "electronics_tray", "name": "Servo chassis and electronics tray", "role": "Carry structural loads, capture both SCS0009 body envelopes, slide into the shell, and support the removable Pi carrier.", "quantity": 1, "separately_manufactured": true, "manufacturing_process": "FDM", "material": "PETG", "notes": "Integrated servo cradle lips are provisional until the purchased servo cases are measured and insertion force is tested."},
    {"part_id": "service_panel", "name": "Tether-ready service panel", "role": "Provide tool-less rear access and a bounded opening for the regulated 5 V Rev A power lead.", "quantity": 1, "separately_manufactured": true, "manufacturing_process": "FDM", "material": "PETG", "notes": "Rev A intentionally excludes a battery and charging circuit."},
    {"part_id": "left_limb", "name": "Left rotating limb", "role": "Provide a long rounded ground-contact surface through the left servo rotation envelope.", "quantity": 1, "separately_manufactured": true, "manufacturing_process": "FDM", "material": "PETG", "notes": "Printed flat; recovery, gait, load capacity, and collision freedom remain unverified."},
    {"part_id": "right_limb", "name": "Right rotating limb", "role": "Provide a long rounded ground-contact surface through the right servo rotation envelope.", "quantity": 1, "separately_manufactured": true, "manufacturing_process": "FDM", "material": "PETG", "notes": "Mirrored role; recovery, gait, load capacity, and collision freedom remain unverified."},
    {"part_id": "left_servo_adapter", "name": "Left keyed servo adapter", "role": "Connect the selected servo horn family to the left printed limb through a replaceable keyed interface.", "quantity": 1, "separately_manufactured": true, "manufacturing_process": "FDM", "material": "PETG", "notes": "The supplied horn and center screw remain purchased hardware; exact spline and horn fit require the physical servo."},
    {"part_id": "right_servo_adapter", "name": "Right keyed servo adapter", "role": "Connect the selected servo horn family to the right printed limb through a replaceable keyed interface.", "quantity": 1, "separately_manufactured": true, "manufacturing_process": "FDM", "material": "PETG", "notes": "The supplied horn and center screw remain purchased hardware; exact spline and horn fit require the physical servo."},
    {"part_id": "camera_bezel", "name": "Camera bezel and locating frame", "role": "Locate a 25 x 24 mm OV5647-family reservation against the front shell while keeping the lens field unobstructed.", "quantity": 1, "separately_manufactured": true, "manufacturing_process": "FDM", "material": "PETG", "notes": "Supplier-specific PCB, lens, cable, and hole positions must be measured before claiming fit."},
    {"part_id": "electronics_carrier", "name": "Raspberry Pi Zero 2 W carrier", "role": "Slide onto the chassis and provide four standoffs using the official 58 x 23 mm Zero-family mounting-hole pattern.", "quantity": 1, "separately_manufactured": true, "manufacturing_process": "FDM", "material": "PETG", "notes": "M2.5 nylon fasteners are intentionally used for the purchased PCB; printed-part joins remain tool-less."}
  ],
  "component_envelopes": [
    {"component_id": "compute_board", "name": "Raspberry Pi Zero 2 W", "quantity": 1, "evidence": "manufacturer", "dimensions_mm": {"length": 65.0, "width": 30.0, "height": 1.6}, "mass_g": 10.0, "source": "Raspberry Pi Zero 2 W official product brief and mechanical drawing: 65 x 30 mm outline and 58 x 23 mm mounting pattern; connector and fitted-header keep-outs remain configuration-dependent."},
    {"component_id": "serial_servo", "name": "Feetech SCS0009 serial bus servo", "quantity": 2, "evidence": "manufacturer", "dimensions_mm": {"length": 23.2, "width": 12.1, "height": 25.25}, "mass_g": 13.2, "source": "Feetech SCS0009 product specification; 20T horn/spline revision and supplied horn geometry must be checked on the purchased unit."},
    {"component_id": "camera", "name": "OV5647-family Pi Zero camera module", "quantity": 1, "evidence": "placeholder", "dimensions_mm": {"length": 25.0, "width": 24.0, "height": 9.0}, "mass_g": null, "source": "GrowBot V0 selects an OV5647 camera; the Ariad reservation accepts a common 25 x 24 mm board envelope, but the exact supplier board, lens, and narrow CSI cable are not selected."},
    {"component_id": "imu", "name": "MPU-6050 GY-521 IMU module", "quantity": 1, "evidence": "placeholder", "dimensions_mm": {"length": 21.0, "width": 16.0, "height": 4.0}, "mass_g": null, "source": "Functional reservation only; GY-521 supplier layouts vary and no mounting interface is released until a board is selected and measured."}
  ],
  "interfaces": [
    {"interface_id": "shell_tray", "name": "Snap-latched shell to structural tray", "kind": "captured", "participants": ["part:front_shell", "part:electronics_tray"], "clearance_mm": 0.4, "axis": null, "requirements": ["Tray slides from the rear and both planar hooks remain externally releasable.", "Servo loads route through the tray and shell, never through the Pi.", "Fit and latch life require physical calibration."]},
    {"interface_id": "service_access", "name": "Slide-lock rear service panel", "kind": "removable_panel", "participants": ["part:service_panel", "part:front_shell"], "clearance_mm": 0.4, "axis": null, "requirements": ["Panel remains removable with the power disconnected.", "The tether notch must not pinch the selected cable.", "No battery or charger is enclosed in Rev A."]},
    {"interface_id": "left_rotary_joint", "name": "Left servo-to-limb rotary joint", "kind": "rotating", "participants": ["part:front_shell", "part:left_servo_adapter", "part:left_limb", "component:serial_servo"], "clearance_mm": 0.5, "axis": "Shared transverse X axis through the left body wall", "requirements": ["Limb sweep must not collide with the body shell.", "Manufacturer horn hardware may be used."]},
    {"interface_id": "right_rotary_joint", "name": "Right servo-to-limb rotary joint", "kind": "rotating", "participants": ["part:front_shell", "part:right_servo_adapter", "part:right_limb", "component:serial_servo"], "clearance_mm": 0.5, "axis": "Shared transverse X axis through the right body wall", "requirements": ["Limb sweep must not collide with the body shell.", "Manufacturer horn hardware may be used."]},
    {"interface_id": "camera_mount", "name": "Camera board and bezel stack", "kind": "captured", "participants": ["part:front_shell", "part:camera_bezel", "component:camera"], "clearance_mm": 0.2, "axis": null, "requirements": ["The PCB, lens, and CSI ribbon must not be compressed.", "Supplier-specific dimensions must replace the reservation before fit is claimed."]},
    {"interface_id": "pi_carrier", "name": "Pi carrier to chassis and board", "kind": "fastened", "participants": ["part:electronics_carrier", "part:electronics_tray", "component:compute_board"], "clearance_mm": 0.4, "axis": null, "requirements": ["Carrier slides on twin dovetails.", "The Pi uses four M2.5 nylon fasteners at the 58 x 23 mm pattern.", "microSD, USB, GPIO, CSI ribbon, and ventilation remain serviceable."]},
    {"interface_id": "servo_capture", "name": "Dual servo cradle capture", "kind": "captured", "participants": ["part:electronics_tray", "component:serial_servo"], "clearance_mm": 0.5, "axis": null, "requirements": ["Both servo bodies are supported against reaction torque.", "Servo wires exit without sharp bends.", "Insertion and retention forces require measured hardware and physical testing."]}
  ],
  "assembly_constraints": [
    "Component selection and internal layout precede the exterior blueprint and shell release.",
    "Rev A contains no battery or charging module and uses an external regulated 5 V supply.",
    "Exactly two independently actuated limbs are mounted outside the left and right body walls.",
    "No structural load routes through the camera, IMU, or compute board.",
    "Separately printed parts use serviceable slide, snap, press, or keyed interfaces; purchased electronics may use manufacturer-appropriate fasteners.",
    "Every printed part receives its own geometry, orientation, slice, and artifact records.",
    "Hardware remains disconnected and physical success remains unclaimed."
  ],
  "unresolved_questions": [
    "Which exact OV5647 camera board and narrow CSI ribbon will replace the camera reservation?",
    "Which exact GY-521 module will define the IMU mount?",
    "What are the measured supplied-horn and spline dimensions of the purchased SCS0009 revision?",
    "Which regulated external 5 V supply and cable overmould define the tether keep-out?",
    "What measured clearance coupon maps the 0.4 mm interlock allowance to the eventual printer and PETG batch?",
    "What mass distribution and limb profile are required for simulated and physical recovery?"
  ],